{
  "id": "clm:01KYGD2M31Q565Y0RCJ1NHGMH2",
  "subject": "ent:scheme:mgnrega-madhya-pradesh",
  "predicate": "scheme_expenditure",
  "value": {
    "type": "money",
    "amount": 95136800000,
    "currency": "INR",
    "as_printed": "₹9513.68 crore"
  },
  "qualifiers": {
    "financial_year": "2020-21"
  },
  "assertion_type": "recorded_by_authority",
  "evidence": {
    "source_id": "src:cag:mp-report-4-2026-mgnrega",
    "page": 57,
    "locator": "Chart 4.1 \"Funds released and expenditure incurred\", Total Expenditure series, financial year 2020-21 (printed page 31)"
  },
  "status": "verified",
  "extraction": {
    "method": "model_assisted",
    "model": "claude-opus-5",
    "extracted_at": "2026-07-26T23:18:56Z"
  },
  "verification": {
    "verified_by": "handle:anrun",
    "verified_at": "2026-07-26T23:26:00Z",
    "note": "Checked against the rendered page of the archived copy, at the locator given."
  },
  "created_at": "2026-07-26T23:18:56Z",
  "updated_at": "2026-07-26T23:26:00Z"
}
