{
  "id": "clm:01KYGD2M37CHMRA3WY8MAZW1PD",
  "subject": "ent:body:mp-state-employment-guarantee-council",
  "predicate": "audit_observation",
  "value": {
    "type": "string",
    "text": "The Council's audited financial statement recorded liabilities for wages and material of ₹1217.05 crore as on 31 March 2024, comprising ₹564.76 crore for wages and ₹652.29 crore for material.",
    "lang": "en"
  },
  "qualifiers": {
    "financial_year": "2023-24"
  },
  "assertion_type": "recorded_by_authority",
  "evidence": {
    "source_id": "src:cag:mp-report-4-2026-mgnrega",
    "page": 61,
    "locator": "para 4.4 and footnote 8 (printed page 35)"
  },
  "status": "verified",
  "extraction": {
    "method": "model_assisted",
    "model": "claude-opus-5",
    "extracted_at": "2026-07-26T23:18:56Z"
  },
  "verification": {
    "verified_by": "handle:anrun",
    "verified_at": "2026-07-26T23:26:00Z",
    "note": "Checked against the rendered page of the archived copy, at the locator given."
  },
  "created_at": "2026-07-26T23:18:56Z",
  "updated_at": "2026-07-26T23:26:00Z"
}
