{
  "id": "clm:01KYGD2M39Y4MJET44SGCCWFDG",
  "subject": "ent:body:mp-state-employment-guarantee-council",
  "predicate": "audit_observation",
  "value": {
    "type": "string",
    "text": "Compensation approved for delayed payment of wages during 2019-24 totalled ₹35.13 lakh, of which ₹26.06 lakh had been paid and ₹9.07 lakh remained to be paid as on 31 March 2024, against 64,70,161 approved days of delay.",
    "lang": "en"
  },
  "qualifiers": {
    "financial_year": "2023-24"
  },
  "assertion_type": "recorded_by_authority",
  "evidence": {
    "source_id": "src:cag:mp-report-4-2026-mgnrega",
    "page": 61,
    "locator": "Table 4.2, total row (printed page 35)"
  },
  "status": "verified",
  "extraction": {
    "method": "model_assisted",
    "model": "claude-opus-5",
    "extracted_at": "2026-07-26T23:18:56Z"
  },
  "verification": {
    "verified_by": "handle:anrun",
    "verified_at": "2026-07-26T23:26:00Z",
    "note": "Checked against the rendered page of the archived copy, at the locator given. Table 4.2 total row only; the per-year rows are not claimed here."
  },
  "created_at": "2026-07-26T23:18:56Z",
  "updated_at": "2026-07-26T23:26:00Z"
}
