{
  "id": "clm:01KYGD2M38XM9YAGK0ZSTQ9ZB0",
  "subject": "ent:body:mp-state-employment-guarantee-council",
  "predicate": "audit_observation",
  "value": {
    "type": "string",
    "text": "Of the liabilities recorded as on 31 March 2024, ₹54.79 crore towards wages, across 4.7 lakh transactions, was attributed to the non-mapping of beneficiary accounts with Aadhaar.",
    "lang": "en"
  },
  "qualifiers": {
    "financial_year": "2023-24"
  },
  "assertion_type": "recorded_by_authority",
  "evidence": {
    "source_id": "src:cag:mp-report-4-2026-mgnrega",
    "page": 61,
    "locator": "para 4.4 and footnote 9 (printed page 35)"
  },
  "status": "unverified",
  "extraction": {
    "method": "model_assisted",
    "model": "claude-opus-5",
    "extracted_at": "2026-07-26T23:45:00Z"
  },
  "created_at": "2026-07-26T23:45:00Z"
}
