{
  "id": "clm:01KYGD2M35F4RP3GYV4AW9MHCZ",
  "subject": "ent:body:mp-state-employment-guarantee-council",
  "predicate": "audit_observation",
  "value": {
    "type": "string",
    "text": "Funds available were not fully utilised during 2019-24, with unutilised funds reaching ₹1703.80 crore in 2021-22. Government accepted the position in September 2025, stating that funds received towards the end of 2021-22 could not be withdrawn from the bank in time.",
    "lang": "en"
  },
  "qualifiers": {
    "financial_year": "2021-22"
  },
  "assertion_type": "recorded_by_authority",
  "evidence": {
    "source_id": "src:cag:mp-report-4-2026-mgnrega",
    "page": 57,
    "locator": "para 4.2, paragraph immediately following Chart 4.1 (printed page 31)"
  },
  "status": "unverified",
  "extraction": {
    "method": "model_assisted",
    "model": "claude-opus-5",
    "extracted_at": "2026-07-26T23:45:00Z"
  },
  "created_at": "2026-07-26T23:45:00Z"
}
